{
  "schema_version": "v1",
  "source_topic": "stellarmesh.logging.events.v2",
  "source_partition": 1,
  "source_offset": 42,
  "source_timestamp": "2026-08-01T12:00:00Z",
  "source_key_base64": "dHJhY2UtMQ==",
  "reason": "invalid_event",
  "error": "invalid event kind",
  "payload_base64": "e30=",
  "failed_at": "2026-08-01T12:00:01Z"
}
